wb-id,user-id,user-name,clean_content,full_content,related_video,related_pics,retweet,forward,comment,like,created at,relative time
4461107512719207,7298502196,喻金萍2628,@大漠鱼,<a href='/n/大漠鱼'>@大漠鱼</a>,{},{},"{'id': '4461107294657486', 'content': '本人杨祥斌。今年56岁。躺在家里病床上的是我的妻子，喻金萍，六年前因病致残。去年9月9日因为再次脑出血。汉阳医院住院治疗4个月。元月8日出院回家至今。早上因为太累，刚刚在沙发上躺了一会儿，妻子把胃管拔掉了。找了社区卫生站，然后找了辖区的卫生所，都没有医生护士会上胃管，走投无路之下，万般无奈，抱着最后的一线希望。打武汉市长专线希望能帮我们联系相关的医院，派护士到家里来从早上10:00，到下午4:00到现在晚上9:00又打了一次。三次电话打通后回复都是帮我们联系相关部门，早点问我们解决问题。从早上10点到现在已经快12个小时了，还在研究，还在协调。来叫我们耐心等待。妻子从早上吃了一点东两之后，至今到现在还没吃什么东西，因为切开的气管没缝合喂一点点水，就容易呛着。到现在妻子小便还没解出来。老百姓的命难道就这么不值钱，命如草芥吗？ <a data-url=""http://t.cn/RJU4K7B"" href=""http://weibo.com/p/100101B2094655D469A6F5469D"" data-hide=""""><span class=\'url-icon\'><img style=\'width: 1rem;height: 1rem\' src=\'https://h5.sinaimg.cn/upload/2015/09/25/3/timeline_card_small_location_default.png\'></span><span class=""surl-text"">武汉·碧水晴天</span></a> <a data-url=""http://t.cn/A6vVwwm4"" href=""https://video.weibo.com/show?fid=1034:4461107247513631"" data-hide=""""><span class=\'url-icon\'><img style=\'width: 1rem;height: 1rem\' src=\'https://h5.sinaimg.cn/upload/2015/09/25/3/timeline_card_small_video_default.png\'></span><span class=""surl-text"">喻金萍2628的微博视频</span></a>', 'user': {'id': 7298502196, 'name': '喻金萍2628'}}",0,0,0,1581536509.020064,01-15
4461107294657486,7298502196,喻金萍2628,本人杨祥斌。今年56岁。躺在家里病床上的是我的妻子，喻金萍，六年前因病致残。去年9月9日因为再次脑出血。汉阳医院住院治疗4个月。元月8日出院回家至今。早上因为太累，刚刚在沙发上躺了一会儿，妻子把胃管拔掉了。找了社区卫生站，然后找了辖区的卫生所，都没有医生护士会上胃管，走投无路之下，万般无奈，抱着最后的一线希望。打武汉市长专线希望能帮我们联系相关的医院，派护士到家里来从早上10:00，到下午4:00到现在晚上9:00又打了一次。三次电话打通后回复都是帮我们联系相关部门，早点问我们解决问题。从早上10点到现在已经快12个小时了，还在研究，还在协调。来叫我们耐心等待。妻子从早上吃了一点东两之后，至今到现在还没吃什么东西，因为切开的气管没缝合喂一点点水，就容易呛着。到现在妻子小便还没解出来。老百姓的命难道就这么不值钱，命如草芥吗？  ,"本人杨祥斌。今年56岁。躺在家里病床上的是我的妻子，喻金萍，六年前因病致残。去年9月9日因为再次脑出血。汉阳医院住院治疗4个月。元月8日出院回家至今。早上因为太累，刚刚在沙发上躺了一会儿，妻子把胃管拔掉了。找了社区卫生站，然后找了辖区的卫生所，都没有医生护士会上胃管，走投无路之下，万般无奈，抱着最后的一线希望。打武汉市长专线希望能帮我们联系相关的医院，派护士到家里来从早上10:00，到下午4:00到现在晚上9:00又打了一次。三次电话打通后回复都是帮我们联系相关部门，早点问我们解决问题。从早上10点到现在已经快12个小时了，还在研究，还在协调。来叫我们耐心等待。妻子从早上吃了一点东两之后，至今到现在还没吃什么东西，因为切开的气管没缝合喂一点点水，就容易呛着。到现在妻子小便还没解出来。老百姓的命难道就这么不值钱，命如草芥吗？ <a data-url=""http://t.cn/RJU4K7B"" href=""http://weibo.com/p/100101B2094655D469A6F5469D"" data-hide=""""><span class='url-icon'><img style='width: 1rem;height: 1rem' src='https://h5.sinaimg.cn/upload/2015/09/25/3/timeline_card_small_location_default.png'></span><span class=""surl-text"">武汉·碧水晴天</span></a> <a data-url=""http://t.cn/A6vVwwm4"" href=""https://video.weibo.com/show?fid=1034:4461107247513631"" data-hide=""""><span class='url-icon'><img style='width: 1rem;height: 1rem' src='https://h5.sinaimg.cn/upload/2015/09/25/3/timeline_card_small_video_default.png'></span><span class=""surl-text"">喻金萍2628的微博视频</span></a>","{'id': '4461107247513631', 'stream_url': 'http://f.video.weibocdn.com/003Vt74Alx07Abihig1a010412007SLO0E010.mp4?label=mp4_720p&template=720x1280.24.0&trans_finger=c3f00996be5378650057cf237d7bfffd&Expires=1581540113&ssig=XT0qa0GQIB&KID=unistore,video'}",{},{},4,2,2,1581536513.49802,01-15
4461035366570326,7298502196,喻金萍2628,回复@大漠鱼:我是你的微博群里面祥斌16。乜是你的微信好友。因为前两个微博号都被封杀了。我们夫妻6年来所经历的一切。2017年5月我以相依相伴的人为注册名，发到天涯社区天涯杂谈上的帖子。（屈辱的社会救助，瞒上欺下的精准扶贫。）里面详细的描述。因为妻子病情特殊，脑血管畸形，从13年到现在已经住院治疗，4次,回复<a href='/n/大漠鱼'>@大漠鱼</a>:我是你的微博群里面祥斌16。乜是你的微信好友。因为前两个微博号都被封杀了。我们夫妻6年来所经历的一切。2017年5月我以相依相伴的人为注册名，发到天涯社区天涯杂谈上的帖子。（屈辱的社会救助，瞒上欺下的精准扶贫。）里面详细的描述。因为妻子病情特殊，脑血管畸形，从13年到现在已经住院治疗，4次,{},{},"{'id': '4460225350777033', 'content': '妻子回家已经6天了。6天里不分白天黑夜的照顾妻子。身心疲惫。妻子现在右边身子瘫痪，大小便不能自理，完全需要人帮助，40多天了，切开的气管还没缝合。因为尿管插了近4个月，出院回家时。给拿掉了，但现在妻子一咳嗽就容易引起尿崩。有时几分钟内要换几次纸尿裤。我们是低保困难家庭。妻子因病瘫痪已6年多。在6年里我们经历了许多许多事情。有善良的，美好的。也有肮脏的，龌龊的。从92年下岗回家。至今已27年。作为一个国有企业的下岗职工，我们为这个国家经济发展承担了许多不应该承担的负担。下岗了20年没有一分钱的生活费。就是这样困难情况下。我们依然保持着做人的良知。给予他人的善良。坚守着这个社会的道德底线。从妻子因病致残的那天起至今，从没有放弃过对妻子的照顾。始终不离不弃。因为我们是有情感的人类。而不是像桥口区民政局。宝丰街办事处。桥北社区一群人渣。打着依法行政的旗号。党和人民赋予他们的权利。为一己私利。漠视他人的生命。践踏别人的尊严。在这6年里做尽了人世间最肮脏最无耻的龌龊事。详情。见本人17年5月。以相依相伴的人为注册名，发在天涯社区天涯杂谈上的，各为（屈辱的社会救助，瞒上欺下的精准扶贫）的帖子。人的一生其实很短暂。真正从参加工作到退休也就仅仅20多年。在这20多年里。能够保持一个最基本的做人良知。是作为一个政府公务人员，社区工作者最基本的道德底线。如果连这点最基本的要求都做不到。即使有多少的荣誉称号挂在墙上。也掩盖不了其内心肮脏的人格。从92年下岗至今没有做过任何违法乱纪的事情。无论家里生活多么困难。也保持做人的底线。唯一做过的事情就是在2003年本人申请低保时。向武汉市政府和湖北经视直播。揭露了桥口区民政局宝丰街办事处桥北社区相关工作人员在为社区困难群众申请办理低保时。对社区群众吃卡拿要。吃空饷。变相可靠挪用困难群众的低保金。等等许多违法犯罪的行为。断了他们的财路，并且相关责任人受到了行政撤职的处分，没想到十几年过去了。从桥口区民政局到宝丰街办事处到桥北社区。依旧和十几年前一样。知法犯法。一些违法的文件。口头编造一些所谓的政策依据。利用社会救助资金现金发放和群众不知晓社会救助政策的管理漏洞.，贪污挪用像我们夫妻这样的低保重度残疾人家庭的社会救助资金。', 'user': {'id': 7298502196, 'name': '喻金萍2628'}}",0,0,0,1581536517.634794,01-15
4461034603107478,7298502196,喻金萍2628,回复@我是胖小苍:是湖北省，武汉市，硚口区，老武汉叫硚口为桥口，我们是硚口区宝丰街桥北社区低保户，妻子13年8月30日，因病致残后。直到17年下半年才按武汉市2011年制定的重度残疾人单独全额享受低保，并在此基础上增加20%的待遇。//@我是胖小苍:桥口区是什么地方,回复<a href='/n/我是胖小苍'>@我是胖小苍</a>:是湖北省，武汉市，硚口区，老武汉叫硚口为桥口，我们是硚口区宝丰街桥北社区低保户，妻子13年8月30日，因病致残后。直到17年下半年才按武汉市2011年制定的重度残疾人单独全额享受低保，并在此基础上增加20%的待遇。//<a href='/n/我是胖小苍'>@我是胖小苍</a>:桥口区是什么地方,{},{},"{'id': '4455785209776240', 'content': '对于桥口区民政局宝丰街办事处。桥北社区。一帮人渣。在我妻子喻金萍2013年8月30日，因为脑出血在武汉市汉阳医院住院治疗十个多月。经历3次头部手术，两次开颅。我们自己支付近20万元，妻子从一个正常人因病致残，成了一个肢体一级重度残疾智十三级的重度残疾人。我们家庭生活已经处于非常困苦不堪的境地中，所有低保残疾人应该及时享受的相关社会救助，如重度残疾人单独全额享受低保，并在此基础上增加20%……等等相关社会救助都没有给我们及时办理的情况下。15年16年17年连续三年减少我们低保的过程，作一个详细描述。妻子2014年7月8日在汉阳医院住院治疗，十个多月社区街道民政局无一人到医院看望慰问的情况下。2017年7月21日本人第1次到社区要求桥北社区低保专干，按照政策文件规定，申请办理临时救助和妻子第3次的大病医后救助。桥北社区低保专干就开始撒谎，以大病医后救助就是临时救助。以及申请大病医后救助必须写一个妻子住院原始发票不要那个承诺书等无耻要求。欺骗敲诈勒索。被本人严词拒绝后。擅自就将本人的低保申请从及早拿回和临时救助申请一并退还给我们。我回家后的心酸过程，见本人2017年5月。以相依相伴的人为注册名天涯社区天涯杂谈上。以（屈辱的社会救助， 瞒上欺下的精准扶贫）为标题发的帖子。一直到2015年春节后后本人再次到桥北社区要求按规定给我们办理临时救助事。桥北社区低保专干又编造出一个，无论我为妻子申请办理临时救助还是大病医疗救助。都必须提供住院原始单据。否则不予办理。复印件概不受理的更卑鄙无耻理由，并声称所有桥北社区，在她这里申请办理社会救助的困难群众在她担任低保专干后都是如此。所以本人要求也出具一个书面的说明。并要求宝丰街低保专干在书面说明上加盖公章。但社区街道都既不出具书面证明。也拉不出什么文件依据。所以本人从那时起就开始在家通过互联网向省市相关职能部门实名举报硚口区民政局，宝丰街办事处，桥北社区相关工作人员违法乱纪行为的错误行为。从此就开始了，本人向政府相关职能部门实名举报，区民政局街道社区一帮人渣就开始以各种编造的事实和谎言，以减少我们本就已经不能保证基本生活的低保金，对本人进行打击报复。在三次核减我们低保的过程中。没有任何一个街道社区低保专干，按照低保管理条例的明确规定。到本人家中进行入户调查。邻里走访。并提供一份由本人及街道社区低保专干三人共同签字确认的（家庭经济状况入户调查表）。桥北社区主任也没有按规定组织有社区党员和居民代表组成的，同意核减本人低保金的民主评议小组，更提供不了社区民主评议会议记录。而且2015年的低保调整通知书。还是本人多次向桥口区民政局低保中心主任当面宣传法律法规常识后，桥口区民政局才勉强通过宝丰街办事处，桥北社区。在2015年4月20日，给本人出具了一份没有加盖硚口区民政局，宝丰街办事处行政公章。和区民政局，街道分管社会救助工作负责人签名的无效通知书，直到2015年12月在本人的强烈要求下。桥口区民政局的杜副局长，才在第一次核减我们低保的调整通知书上盖上单位行政公章。但依旧拒绝签名。而桥口区民政局低保中心，一个在民政系统工作数10年的法盲主任。称我本人没有权利她也没义务在低保调整通知书上盖上公章。并签上她本人的姓名。这样的一个没有任何法律常识的硚口区低保中心主任，2018年居然被硚口区纪监委评为了勤政廉政的个人标兵。武汉市政府从2001年开始实施低保政策起，所有制定的低保政策文件规定中都明确规定，低保工作必须依照谁签字谁负责的管理原则。无论取消或者调整低保，都必须由民政局出具出具书面通知书。再由街道通过社区转交给本人。而且合法合规的书面通知书。是辖区困难群众在受到民政局街道社区的不法侵害后，为维护自己的合法权益。通过正常的法律途径。向各级政府部门的法制办。及人民法院提起行政复议和行政诉讼的必备要件。我们2015年的续保申请资料，本人4月6号才交到桥北社区。而本人通过申请政府信息公开，硚口区民政局出具给本人的低保调整通知书上显示的日期。却是2015年2月28日。对于这种突破社会公共道德底线，违背公序良俗。与党和国家一再强调的要加强对低保困难群众，特别是低保重度残疾人家家庭加大救助力度的社会保障政策相对抗，肆意侵害低保重店残疾人家庭合法权益的违法犯罪行为。6年多的时间过去了。没有一个政府纪监部门和职能部门进行查处。从桥口区民政局到丰街办事处到桥北社区，至今没有一个人对此而感到羞耻。今天就写到这。希望每一个看到此微博的避友们帮忙转发。扩散。谢谢大家。再次强调本人对所有发到微博上的文字内容负一切法律责任。 <a data-url=""http://t.cn/R2WxQOQ"" href=""http://weibo.com/p/1001018008642010000000000"" data-hide=""""><span class=\'url-icon\'><img style=\'width: 1rem;height: 1rem\' src=\'https://h5.sinaimg.cn/upload/2015/09/25/3/timeline_card_small_location_default.png\'></span><span class=""surl-text"">武汉</span></a>', 'user': {'id': 7298502196, 'name': '喻金萍2628'}}",0,0,0,1581536520.872185,01-15
4461027943424052,7298502196,喻金萍2628,"一个人在家照顾瘫痪在床的妻子。真的很累很难。早上从6点忙到9:30。从妻子解大便，然后到给她擦身换床单，,换完床单，从胃管里把早上吃的东西打进去喂完，忙完刚刚在沙发上躺了一会，听见妻子在用手摇着床架子响。起来一看妻子把胃管拉掉，从中午到现在，打电话打市长专线求教，打卫生院的电话。打医院的电话到现在还没人来。中午到现在妻子就是吃的平常了，1/4一点点。水也喝得很少。现在妻子这种状况又不能到医院去。在汉阳医院4个月，我们是实在坚持不了了才回家，回家买了家里买了医疗床，买了吸痰器，买氧气瓶。可是一不小心到现在胃口没了，在武汉这样偌大的一个城市都没有人帮我们解决一下这样的困难。难道让妻子在家里就这样活活饿死吗？ ","一个人在家照顾瘫痪在床的妻子。真的很累很难。早上从6点忙到9:30。从妻子解大便，然后到给她擦身换床单，,换完床单，从胃管里把早上吃的东西打进去喂完，忙完刚刚在沙发上躺了一会，听见妻子在用手摇着床架子响。起来一看妻子把胃管拉掉，从中午到现在，打电话打市长专线求教，打卫生院的电话。打医院的电话到现在还没人来。中午到现在妻子就是吃的平常了，1/4一点点。水也喝得很少。现在妻子这种状况又不能到医院去。在汉阳医院4个月，我们是实在坚持不了了才回家，回家买了家里买了医疗床，买了吸痰器，买氧气瓶。可是一不小心到现在胃口没了，在武汉这样偌大的一个城市都没有人帮我们解决一下这样的困难。难道让妻子在家里就这样活活饿死吗？ <a data-url=""http://t.cn/R2WxQOQ"" href=""http://weibo.com/p/1001018008642010000000000"" data-hide=""""><span class='url-icon'><img style='width: 1rem;height: 1rem' src='https://h5.sinaimg.cn/upload/2015/09/25/3/timeline_card_small_location_default.png'></span><span class=""surl-text"">武汉</span></a>",{},{},{},0,1,0,1581536526.117511,01-15
4460937429705255,7298502196,喻金萍2628,全民免费医疗，小孩上学免费，官员财产公开，两岸统一后，大陆台湾人民能共享//@薛惠芳1:转发微博,全民免费医疗，小孩上学免费，官员财产公开，两岸统一后，大陆台湾人民能共享//<a href='/n/薛惠芳1'>@薛惠芳1</a>:转发微博,{},{},"{'id': '4460914595833472', 'content': ""该账号因被投诉违反法律法规和《微博社区公约》的相关规定，现已无法查看。查看帮助 <a href='https://kefu.weibo.com/faqdetail?id=13216' data-hide=''><span class='url-icon'><img style='width: 1rem;height: 1rem' src='//h5.sinaimg.cn/upload/2015/09/25/3/timeline_card_small_web_default.png'></span> <span class='surl-text'>网页链接</span></a>"", 'user': {}}",0,0,1,1581536530.262821,01-15
4460394045669046,7298502196,喻金萍2628,妻子因脑出血在汉阳医院住院四个月，转入普通病房三个月，仅护工费15000多元，，而护工费得自费，全世界一百多个国家，医疗收费的国家就二十几个，其中就有中国，,妻子因脑出血在汉阳医院住院四个月，转入普通病房三个月，仅护工费15000多元，，而护工费得自费，全世界一百多个国家，医疗收费的国家就二十几个，其中就有中国，,{},{},"{'id': '4460351892711372', 'content': '<a  href=""https://m.weibo.cn/search?containerid=231522type%3D1%26t%3D10%26q%3D%232020%E5%B9%B4%E6%B9%96%E5%8C%97%E4%B8%A4%E4%BC%9A%23&extparam=%232020%E5%B9%B4%E6%B9%96%E5%8C%97%E4%B8%A4%E4%BC%9A%23"" data-hide=""""><span class=""surl-text"">#2020年湖北两会#</span></a>【<span class=""url-icon""><img alt=[话筒] src=""//h5.sinaimg.cn/m/emoticon/icon/others/o_huatong-a3c5f9bcc2.png"" style=""width:1em; height:1em;"" /></span>好消息！居民医保人均提高15元，保障高血压、糖尿病门诊用药】湖北省人大代表、武汉亚洲心脏病总经理叶红告诉记者，政府工作报告中提出要提高人民健康水平，没有全民健康，也就没有全民小康。她介绍，今年政府工作报告中提出：居民医保人均财政补助标准提高15元，完善城乡居民高血压、糖尿病门诊用药保障机制。（记者徐佳 拍摄肖僖\xa0制作张小莉 审看寇鹏）  <a data-url=""http://t.cn/A6vzsAVZ"" href=""https://video.weibo.com/show?fid=1034:4460351354241083"" data-hide=""""><span class=\'url-icon\'><img style=\'width: 1rem;height: 1rem\' src=\'https://h5.sinaimg.cn/upload/2015/09/25/3/timeline_card_small_video_default.png\'></span><span class=""surl-text"">长江日报的微博视频</span></a>', 'user': {'id': 1898268644, 'name': '长江日报'}}",1,0,1,1581536535.412983,01-13
4460279943103925,7298502196,喻金萍2628,转发微博,转发微博,{},{},"{'id': '4458206769780867', 'content': ""我推荐了<a href='/n/喻金萍2628'>@喻金萍2628</a> 提出的问题&quot;当今社会，好人真的有好报吗？&quot;，已有<a href='/n/喻金萍2628'>@喻金萍2628</a> 等人回答，等你围观。 "", 'user': {'id': 7298502196, 'name': '喻金萍2628'}}",0,0,0,1581536540.705305,01-13
4460265858644454,7298502196,喻金萍2628,希望有两会委员提公务员财产公开的议案，因为这些年落马官员贪污受贿的金额太吓人了,希望有两会委员提公务员财产公开的议案，因为这些年落马官员贪污受贿的金额太吓人了,{},{},"{'id': '4460264570809356', 'content': '【2020北京两会丨安钟岩代表反映凉水河污水直排问题 水务局：接诉即办！】1月11日，在北京市人大代表现场询问、政协委员现场咨询活动现场，市人大代表、北京丰顺工贸集团董事长安钟岩反映问题：有人在凉水河违法进行污水直排，“政府下了很大的力气对凉水河进行治理，好不容易让水变清，又有人来搞破坏，必须来反映”。北京市水务局副局长张世清听完安钟岩代表的讲述后表示“接诉即办”，要求凉水河管理处会同排水集团启动执法程序。（北青报记者 解丽 柴程 刘畅 王雯雯 ）<a data-url=""http://t.cn/A6vhrOHd"" href=""https://www.miaopai.com/show/r9kdwFbDsC~eTUzBleJ8VZWUhSUCQ6evMYE1lw__.htm"" data-hide=""""><span class=\'url-icon\'><img style=\'width: 1rem;height: 1rem\' src=\'https://h5.sinaimg.cn/upload/2015/09/25/3/timeline_card_small_video_default.png\'></span><span class=""surl-text"">青流视频的秒拍视频</span></a>', 'user': {'id': 1644948230, 'name': '北京头条'}}",0,0,0,1581536543.957931,01-13
